{
  "$schema": "https://json-schema.org/draft/2020-12/schema",
  "$id": "https://lattice.dev/schemas/status.schema.json",
  "title": "StatusEffectDef",
  "description": "Data-driven status effect (plan/02 \u00A72): a duration, a stacking policy, and a list of logic primitives (modifiers, periodic effects, tags).",
  "type": "object",
  "properties": {
    "id": {
      "type": "string",
      "description": "Globally unique def ID."
    },
    "type": {
      "const": "status"
    },
    "description": {
      "type": "string",
      "description": "One line for humans and LLMs (surfaced by the manifest)."
    },
    "inherits": {
      "type": "string",
      "description": "Parent def ID (same kind); objects deep-merge, scalars override, arrays replace or take {\u0022$append\u0022/\u0022$remove\u0022} patches.",
      "x-lattice-ref": "status"
    },
    "name": {
      "type": "string"
    },
    "duration": {
      "type": "number",
      "description": "Seconds the effect lasts; 0 or negative = permanent until removed."
    },
    "stacking": {
      "type": "string",
      "description": "\u0022refresh\u0022 (reset duration), \u0022stack\u0022 (add stacks up to maxStacks), or \u0022ignore\u0022."
    },
    "maxStacks": {
      "type": "number"
    },
    "logic": {
      "type": "array",
      "items": {
        "type": "object",
        "properties": {}
      }
    }
  },
  "required": [
    "id",
    "type"
  ]
}